date,title,link,content
2024-02-09 11:02:02,"식어버린 전기차 열풍, “이차전지, 겨울이 왔다”",https://n.news.naver.com/mnews/article/005/0001673200?sid=101,"[




이차전지(배터리) 업계가 ‘혹한’의 겨울을 보내고 있다. 전기차 열풍이 식으면서 이차전지와 소재 업체가 직격탄을 맞았다. 증권업계는 이차전지 업체의 목표 주가를 일제히 하향하면서 불황의 터널이 길어질 것이라는 전망을 내놨다.9일 업계에 따르면 LG에너지솔루션은 지난해 4분기 매출액 8조14억원, 영업이익 3382억원으로 시장 기대에 미치지 못하는 실적을 올렸다. 매출액만 보면 2022년 4분기(8조5375억원)보다 6.3% 감소한 수준이다. 삼성SDI도 지난해 4분기 매출액 5조5648억원, 영업이익 3118억원을 기록했다. 2022년 대비 각각 6.7%, 36.5% 쪼그라들었다.SK온은 지난해 연간 매출액 12조8972억원, 영업손실 5818억원을 기록했다. 2022년 대비 매출은 69.3% 증가했고, 영업 적자 폭은 축소했다. 그러나 지난해 4분기만 보면 영업손실은 186억원으로 나타났다. 2021년 10월 출범 이후 9분기 연속 적자 행진이다.이차전지 업계의 실적 부진은 지난해 하반기 불어닥친 전기차 수요 감소 탓이다. 북미, 유럽 등 주요 시장이 위축됐다. 그나마 팔리는 차는 중국산 리튬인산철(LFP) 이차전지가 들어가는 중저가차다. 한국 이차전지 업체는 삼원계(니켈·코발트·망간) 배터리 등 고가 제품군을 주로 판매한다. 리튬, 니켈 등 광물 가격이 큰 폭으로 하락하면서 재고 평가 손실이 반영된 측면도 있다.전기차와 이차전지 부진은 소재 업체에도 타격을 줬다. 에코프로는 연결 기준 지난해 매출이 7조2590억원으로 전년 대비 28.7% 증가한 것으로 잠정 집계됐다고 밝혔다. 역대 최대 매출이지만, 영업이익은 2952억원으로 전년보다 51.9% 감소했고, 순이익도 855억원으로 61.2% 줄었다.4분기만 놓고 보면 더 심각하다. 에코프로의 4분기 영업손실은 1224억원으로 전년 동기(영업이익 1780억원)에서 적자 전환했다. 매출은 1조2736억원으로 전년 동기보다 39.2% 감소했고 직전 분기보단 33% 줄었다.에코프로비엠은 전년 대비 60% 감소한 1532억원의 영업이익을 올렸다. 4분기에만 1147억원의 적자를 냈다. 전구체 업체 에코프로머티리얼즈의 지난해 영업이익은 전년 대비 77% 감소한 88억원에 그쳤다. 양극재 생산기업 앨앤에프도 지난해 2223억원의 영업손실을 기록했고, 포스코퓨처엠은 359억원의 영업이익을 올렸다. 2022년 1659억원에서 1년 만에 78.4% 감소했다.증권가는 이차전지 업체에 대한 목표가를 줄줄이 하향하고 있다. 교보증권은 지난 6일 LG에너지솔루션에 대한 목표주가를 61만원에서 48만원으로 낮췄다. 최보영 교보증권 연구원은 “중대형 에너지저장장치(ESS), 소형 원통, 소형 파우치 등 부문이 부진했다”고 분석했다.하나증권은 삼성SDI 목표가를 기존 108만원에서 81만원으로 낮춰 잡았다. 김현수 하나증권 연구원은 “매출 비중 66%를 차지하는 중대형전지는 지난해 4분기 유럽 전기차 판매가 연간 6% 감소하며 부문 매출이 감소했다”고 짚었다. NH투자증권은 에코프로비엠 목표주가를 35만원에서 29만원으로 낮췄다. 다만 투자의견은 ‘매수’를 유지했다. 키움증권은 포스코퓨처엠 목표가를 48만4000원에서 40만9000원으로 하향했다.
		]"
2024-02-09 13:58:01,"""나만 몰랐나""…2차전지주 줄줄이 '반토막' 진짜 이유는 [성상훈의 배터리스토리]",https://n.news.naver.com/mnews/article/015/0004947020?sid=101,"[
리튬(Li)가 하락에 2차전지주 급락



땅속에서 채굴된 리튬""리튬(Li)가격 하락으로 2차전지주들의 가격이 급락하고 있다""지난해 하반기부터 최근까지 배터리주들 관련해 가장 많이 회자되는 말입니다. 2차전지 소재중 핵심인 리튬의 가격이 떨어지면서 LG에너지솔루션, 삼성SDI, SK이노베이션(SK온)과 같은 배터리 제조사나 에코프로, 엘앤에프, 포스코퓨처엠과 같은 배터리 소재업체들의 주가는 고점대비 반토막이 났습니다. 리튬이 도대체 어떤 광물이길래, 또 얼마나 핵심 소재이길래 배터리사의 '명운'이 여기에 달린걸까요  대체불가능한 핵심 소재 리튬리튬이 얼마나 중요한지를 알아보기 전에 일단 2차전지의 구조를 알아야합니다. 우선 2차전지는 우리가 옛부터 쓰던 리모컨 등에 쓰던 동그란 원통모양의 '건전지'(1차전지)와 달리 여러번 충전을 하면서 쓸 수 있는 전지를 뜻합니다. 한번 방전되면 끝이 아니라 전기를 충전해 여러번 재사용할 수 있습니다. 충전을 위해서는 어느정도 일정한 구조가 필요한데 2차전지에 관심이 있으신분은 여러번 들어보셨을 4대 핵심소재인 바로 양극재, 음극재, 분리막, 전해질입니다. 



2차전지 구조. 자료=포스코퓨처엠전기는 이온이 음극재에서 양극재로 이동하면서 발생합니다. 우리가 전기차를 가동시키면 배터리내에서는 음극재에 있던 이온들이 양극재 방향으로 이동하면서 전기와 열 등이 생겨납니다. 반대로 전기차를 충전하는 동안에는 이온이 다시 양극재에서 음극재 방향으로 이동합니다. 그러니까 충전이 완료된 전지는 이온이 음극재에, 다 방전된 전지에는 이온이 양극재에 있다는 의미입니다.(양극재, 음극재, 분리막, 전해질 등의 자세한 내용은 차차 다루겠습니다.)이때 이온 역할을 하는 것이 바로 리튬입니다. 현재 2차전지의 구조와 소재 함유를 바꾸려는 다양한 연구와 시도가 있지만, 리튬 이온이 이동하면서 전기를 발생시키는 기본 구조는 바꾸기 힘듭니다. 리튬이 획기적인 발명이 없는한 2차전지의 핵심 광물로 자리잡을 것이란 의미입니다. 이 리튬은 주로 양극재를 제조할때 함께 들어갑니다. 양극재에는 코발트, 니켈, 망간 등의 소재로 이뤄지는데 여기에 리튬이 함유됩니다.  모든 배터리사의 고민은 리튬의 안정적 확보전세계 모든 배터리와 관련된 회사는 이 리튬을 확보하는데 사활을 걸고 있습니다. 전기차 시장, ESS(에너지 저장장치) 등 2차전지가 쓰이는 시장이 급격히 커지면서 '2차전지는 점점 더 많이 쓰일 것이 자명하므로 리튬 공급량이 수요를 따라가지 못할 것'이란 불안감에 휩싸인 전세계 배터리 관련사들은 앞다퉈 리튬 광산개발에 뛰어들었습니다. 수입 의존도가 매우 높은 우리 배터리사들도 리튬 공급망을 확대하기 위해 전세계로 나아가고 있습니다. 국내 기업이 볼리비아 리튬 광산, 아르헨티나 리튬 광산 등 투자에 나서고 있다는 뉴스를 심심치 않게 들어보셨을 겁니다.한국광해광업공단의 지난해 9월 자료에 따르면 리튬의 한국내 비축량은 5.8일분에 불과했습니다. 한국내에 비축된 리튬만을 사용하게 되는 상황이 온다면 1주일도 버티지 못한다는 의미입니다. 하지만 자체적으로 리튬을 공급할수 있는 길을 열어놓는다면 혹시나 수입이 막히더라도 대처가 가능하다는 판단입니다.  리튬확보에 불안 떨었던 배터리사, 이제는 공급과잉 '충격'다만 현 상황을 보면 단기적으로는 각국 배터리사 들의 불안이 너무 강했던 것 같습니다. 실제 전기차 등의 수요는 배터리사들의 예측만큼 빠르게 늘어나지 않았고, 과잉 예상된 리튬 공급은 리튬가 급락으로 이어졌습니다. 블룸버그에 따르면 리튬 거래가 가장 많이 일어나는 중국 시장내 리튬 가격은 현재 약 톤당 1만5000달러 수준입니다. 2022년초~2023년초까지 8만달러까지 넘보던 리튬가는 1/6 수준으로 떨어졌습니다. 리튬 가격이 급락하자 리튬을 공급하는 리튬 개발사 뿐 아니라 배터리 소재사, 배터리 제조사 모두의 실적이 악화됐습니다. 소재를 싸게 공급받을 수 있는 기회인데 왜 실적이 악화됐을까요 우선 재고자산때문입니다. 에코프로, 엘앤에프 등 배터리 소재사들은 양극재 등을 만들기 전에 리튬을 충분히 확보해놓았는데, 리튬가가 급락하면서 재고자산 손실이 발생했습니다. 비싼 가격에 미리 리튬을 사놓았는데, 가격이 떨어지면서 보유 자산의 가치가 하락했다는 의미입니다. 올해 실적발표에서 양사는 리튬가 하락에 따른 재고자산손실 규모는 몇천억에 달했습니다. 또 양극재 판매가와 배터리 판매가는 어느정도 리튬가에 연동됩니다. 고객에게 배터리 소재나 배터리를 판매할때 리튬가가 낮아진다면 더 싼 가격에 팔 수밖에 없다는 의미입니다. 비싸게 소재를 사서 만들었는데 정작 팔때가 되서는 싼가격에 판매해야하니 손실이 커질 수밖에 없습니다.현재 국내 배터리사들은 리튬 가격하락에 따른 손실을 방어하면서도 리튬의 안정적인 공급망은 확보해야하는 어려운 과제에 처한 상황입니다. 각 사는 어떤 전략으로 이 과제를 해결해 나갈까요 한 배터리 소재사 관계자는 ""각 사는 리튬 등 원자재 시장상황을 지금보다 정확하고 빠르게 파악할 수 있는 시스템을 갖춰 시설 설비 투자속도를 조절하고, 제품 판매도 조절하는 전략을 짜고 있다""며 ""장기적으로는 가격에 상관없이 공급망을 최대한 많이 확보하려고 하고 있다""고 전했습니다. 
]"
2024-02-10 06:30:00,"""현대차 사야 650만원 받네""…바뀐 전기차 보조금, 뜯어보니[이슈 Replay]",https://n.news.naver.com/mnews/article/008/0004997253?sid=101,"[
[김훈남의 이슈 Replay]보조금의 명과 암, 전기차 확산과 시장왜곡사이 정부의 셈법[편집자주] 지난 한 주 동안 우리 경제에는 어떤 일들이 있었을까요. 머니투데이가 꼭 알아야 할 '핵심 이슈'만 선별해 알기 쉽게 정리했습니다.



올해 전기차 구입계획이 있는 사람이라면 누구나 기다렸을 소식. 정부의 전기차 구매보조금 기준이 공개됐습니다. 매년 줄어들긴 하지만 올해에도 차량가격의 10%가 넘는 최대 650만원까지 국고보조금을 받을 수 있습니다. 그 때문에 정부의 보조금 기준은 어떤 제조사의 어떤 모델을 구입할지 결정하는 데 중요한 요소 중 하나입니다. 국내외 제조사와 소비자들이 연초 발표하는 전기차 보조금 기준에 주목하는 것도, 1월엔 유독 전기차 판매량이 '뚝' 떨어지는 것도 이 때문입니다.정부는 올해 배터리에 초점을 맞춘 보조금 기준을 만들었습니다. 배터리 에너지밀도에 따른 보조금 차등규정을 승용차에까지 확대하고 배터리에서 회수할 수 있는 자원가치를 따져 최대 40%까지 성능보조금을 깎을 수 있도록 한 것입니다. 어떤 배터리를 썼느냐에 따라 200만원 넘는 보조금 차이가 발생하는 만큼 완성차 업계와 소비자의 고민도 깊어질 것으로 보입니다.━환경부 ""싸고 효율 좋은 차 출시해야""━



테슬라 코리아가 13일 서울 영등포구 롯데백화점 영등포점에서 '모델 Y'를 국내 최초공개한 가운데 시민들이 차량을 살펴보고 있다. /사진=김휘선 기자 hwijpg@ 보조금 정책의 주무부처인 환경부는 기준을 통해 시장에 ' 보다 싸고 가볍고, 효율 좋은 차량에 한푼이라도 더 많은 보조금을 지급한다'는 메시지를 전달했다는 입장입니다.보조금은 민간의 경제논리로만 개화하기 어려운 시장이지만 정책적 필요성에 따라 조기 정착을 유도할 때 쓰는 카드입니다. 소비자 가격에 반영되는 기술개발 비용이나 초기투자 비용을 공공에서 부담하는 방식입니다. 경우에 따라서 시장에 영향을 주고 지나치면 독이되기도 하는 게 보조금의 특징입니다.환경부는 보조금이 일정부분 시장의 방향성을 설정하는 효과를 설명합니다. 지난해 보조금 전액 지급 가능 차량가액을 5700만원(올해는 5500만원입니다.)으로 설정하자 주요 전기차 메이커인 테슬라가 5699만원에 '모델Y'를 국내에 출시한 것이 대표적인 사례입니다. 모델Y는 수입차로는 드물게 500만원 넘는 국고보조금을 지원받으면서 '테슬라 대란'을 부르기도 했습니다. 환경부는 지난해에 보조금을 통해 완성차 업계의 전기차 가격인하를 유도한다는 계획입니다. 뿐만 아니라 제조사 프로모션 등으로 판매가격을 할인해줄 경우 최대 100만원까지 추가 보조금을 지급하도록 해 가격인하를 독려하겠다고 합니다. ━공교롭게도 ""현대차 보조금""?━



28일 경북 포항시 송도동 코리아와이드 포항 전기버스 충전시설이 지난 27일 오전부터 원인을 알 수 없는 고장으로 충전에 차질을 빚고 있다. 포항시는 충전시설 업체와 함께 오늘 중으로 복구한다는 계획이다.2023.6.28/뉴스1  Copyright (C) 뉴스1. All rights reserved. 무단 전재 및 재배포 금지.전기차 보조금 지급규정을 받아든 업계나 소비자들의 반응은 또 다릅니다. 일부는 ""현대차 보조금""이라고 꼬집기도 합니다. 환경부는 ""특정 브랜드나 배터리 성분을 염두에 둔 것이 아니다""라며 의도성을 부인하지만 지금의 전기차 보조금 규정은 국산엔 유리한 반면, 외산에는 불리합니다. 배터리 에너지 밀도에 차른 차등지급 규정이 대표적입니다. 사실 에너지 밀도에 따른 보조금 차등지급 규정은 지난해에도 있었는데 전기버스에만 적용했던 기준을 승용까지 확대했습니다. 배터리의 ℓ(리터)당 전력량(Wh·와트시)에 따라 성능보조금을 차등지급하겠다는 얘기입니다. 그동안의 전기차 시장을 살펴보면 중국산 제품이 우위를 보인 분야는 버스같은 상용차량이었습니다. NCM(니켈·코발트·망간) 삼원계 배터리를 쓰는 국산과 달리 저효율 배터리인 LFP(인산철) 배터리를 쓰는 탓에 중국산 버스는 국산에 비해 대당 1억원 이상 싼 가격을 내세우고 있습니다. 지난해 전기버스 보조금에 에너지밀도 기준이 생긴 것도 가격 경쟁력에서 앞서는 중국산 버스를 견제하기 위함이라는 해석이 나왔습니다.중국산 LFP 배터리의 영향은 최근 더 강해지고 있습니다. 지난해 돌풍을 불렀던 테슬라뿐만 아니라 국내 제조사도 저가형 승용 모델에 LFP배터리를 탑재하는 추세입니다. 정부가 배터리 에너지 밀도 기준을 승용까지 확대한 것은 이런 시장 상황과 무관치 않다는 해석이 나오는 이유입니다. 이밖에 성능보조금을 최대치로 받기 위해선 △1회 충전 주행거리 500㎞(킬로미터) 이상 △배터리 1kg당 유가금속 가격총계 2520원 이상 △전국 8개 권역에 직영 AS(사후관리) 센터 운영 등 조건을 충족해야합니다. 업계에선 NCM 배터리를 탑재한 현대·기아차 일부 모델만 이들 조건을 만족하고 최대치로 보조금을 받을 것으로 보고 있습니다.━시장둔화되는 데 보조금은 까다롭다? vs 국내 산업 보호도 해야━



(워싱턴 로이터=뉴스1)조 바이든 미국 대통령이 16일(현지시간) 워싱턴 백악관에서 열린 인플레이션 감축법(IRA) 시행 1년 행사서 연설을 갖고 “IRA 법은 '제조업 르네상스 법'이라고 불린다”고 밝히고 있다. 2023.8.17  ⓒ 로이터=뉴스1  Copyright (C) 뉴스1. All rights reserved. 무단 전재 및 재배포 금지.'국민에게 좋은 차를 좋은 가격에 공급한다' 명분은 설득력이 있습니다. 하지만 해가 갈수록 복잡해지는 보조금 기준은 친환경차 보급대수를 늘려야하는 환경부의 정책 목표와는 다소 어울리지 않는다는 지적이 있습니다.정부의 무공해차 보급목표는 2030년 누적기준 450만대. 올해에만 30만6000대를 보급하기로 했습니다. 반면 시장 상황은 녹록지 않습니다. 자동차는 한번 구입하면 짧게는 5~6년 길게는 10년이상 사용하는 내구재인 탓에 최근 몇년간 폭발적으로 늘어났던 전기차 보급 속도가 떨어질 것이란 관측이 우세합니다. 이런 상황에서 보조금이 줄어들고 기준이 까다로워지는 것은 반길 수 없다는 지적도 있습니다.다만 미국의 IRA(인플레이션감축법)이나 유럽의 핵심원자재법, 프랑스의 전기차 보조금 규정 등 세계 주요국이 앞다퉈 배터리와 반도체 등 자국 핵심산업에 대한 보조금 지원을 하는 점을 고려하면 우리나라의 전기차 보조금도 어느정도 국내 완성차와 배터리 업계에 유리한 설계가 필요하다는 의견도 있습니다. 정부는 나름의 복잡한 셈법을 거쳐 올해 보조금 기준을 발표했습니다. 결과적으로 전기차 보조금을 어떻게 활용할지는 소비자와 제조사의 선택에 달려있습니다. 전기차 보조금 정책의 성패는 정부 기준에 맞춘 시장의 호응과 시장의 상황을 반영할 수 있는 정부의 유연한 정책운용에 달려있을 것으로 보입니다.
]"
2024-02-10 18:37:01,"잘 나가던 K-배터리, 성장세 주춤한 까닭은?",https://n.news.naver.com/mnews/article/031/0000811906?sid=101,"[
글로버 시장 점유율 소폭 감소…신기술·신제품으로 활로 모색연간 100억 달러 고지를 향해 순항하던 K-배터리 산업의 수출 성장세가 주춤하고 있다. 글로벌 시장 점유율이 소폭 감소한 가운데 중국 배터리 제조사들이 두각을 드러내며 치열한 경쟁이 예상된다.



급속충전시설. [사진=인천경제청]산업통상자원부 등에 따르면 지난해 한국의 2차전지 수출액은 98억 3000만 달러로 전년보다 1.6% 감소했다. 연간 2차전지 수출이 전년 대비 감소한 것은 지난 2015년 이후 8년 만이다.한국의 2차전지 수출은 지난 2017년 50억 달러를 처음 돌파한 뒤 빠르게 증가했다. 그리고 2022년 99억 8000만 달러를 기록하며 100억 달러 돌파에 청신호를 밝혔지만 지난해 다소 주춤했다.전기차 시장이 얼어붙은 것이 크게 작용했다. 고금리와 세계적인 경기 침체는 혁신 제품으로 꼽히는 전기차 수요부터 영향을 끼쳤다. 배터리 수요 감소와 더불어 국내 배터리 제조사들의 유럽, 미국 등으로의 생산 거점 이전 등이 K-배터리 수출 둔화로 이어진 것으로 보인다.올해 들어 2차전지 수출 약화 속도가 더욱 빨라지는 추세다. 지난달 2차전지 수출은 5억 9000만 달러로 작년 같은 달보다 26.2% 감소했다.K-배터리가 주춤한 사이 중국 업체들 덩치를 키웠다. 시장조사기관 SNE리서치가 지난 7일 공개한 '2023년 1~12월 글로벌 전기차용 배터리 사용량' 보고서에 따르면 하이브리드를 포함한 글로벌 전기차(EV·PHEV·HEV)에 탑재된 배터리 총사용량은 705.5기가와트시(GWh)로 전년 대비 38.6% 성장했다.국내 배터리 제조업체 3사의 합산 점유율은 23.1%를 차지했다. LG에너지솔루션이 3위, SK온은 5위, 삼성SDI는 7위를 각각 기록했다. LG에너지솔루션의 지난해 누적 배터리 사용량은 95.8GWh로 전년 동기 대비 33.8% 성장했다. 점유율은 13.6%로 전년(14.1%) 대비 소폭 하락해 2위에서 3위로 한계단 내려섰다.SK온은 전년 대비 14.4% 증가한 34.4GWh로 점유율 4.9%를 기록해 전년(5.9%) 대비 소폭 하락했다. 순위는 5위를 유지했다. 삼성SDI는 32.6GWh로 36.1% 늘었다. 점유율은 4.7%에서 4.7%로 소폭 하락, 순위가 6위에서 7위로 밀렸다.



LG에너지솔루션 폴란드 브로츠와프 공장 전경. [사진=LG에너지솔루션]중국은 1, 2위를 차지했다. CATL은 전년 대비 40.8% 성장한 259.7GWh를 기록, 세계 시장 점유율을 36.8%로 늘리며 1위 자리를 지켰다. BYD는 누적 배터리 사용량 111.4GWh로 57.9% 성장, 점유율을 15.8%까지 끌어올리며 LG에너지솔루션을 제치고 2위로 올라섰다.중국의 배터리 제조사들은 가격 우위를 앞세워 주요 완성차 업체들과 합작법인을 세우고 속속 미국 시장에 진출하고 있어 당분간 성장세가 이어질 전망이다. 이에 맞서 K-배터리 업체들은 신제품·신기술을 앞세워 글로벌 시장 점유율을 끌어올리겠다는 계획이다.LG에너지솔루션은 프리미엄 제품인 하이니켈(High-Ni) NCMA 제품 역량을 높이고 중저가 시장 공략을 위한 고전압 미드니켈 NCM(니켈·코발트·망간), LFP(리튬·인산철) 배터리 기술 개발을 가속화할 예정이다. 소형전지 부문에서는 올해 하반기 46-시리즈(Series) 본격 양산할 계획이다. 아울러 원재료 직접 조달 영역 확대 및 기술 개발을 통한 주요 소재 전환, 공급망 직접 투자 강화 등 근본적 원가 경쟁력도 높일 예정이다.삼성SDI는 각형 NCA(니켈·코발트·알루미늄) 신제품인 P6 양산에 돌입해 연간 각형 폼팩터 매출의 두 자릿수를 달성한다는 목표다. 원통형 46파이 배터리 수주도 추진한다. 차세대 배터리인 전고체 배터리 대형 셀 개발에도 속도를 올린다는 구상이다.SK온은 늘어나는 완성차 업체들의 수요에 맞춰 니켈 함량을 기존 대비 일정량 낮춘 미드니켈 배터리, LFP 및 46계열 원통형 배터리를 개발에 집중할 예정이다. 그동안 중점으로 만들던 NCM 배터리에 더해 포트폴리오를 다변화하겠다는 계획이다.
]"
