date,title,link,content
2024-02-01 11:19:01,"""레이EV 작년에 살걸""…2000만원대 가성비 전기차 '초비상'",https://n.news.naver.com/mnews/article/015/0004943803?sid=103,"[
'전기차 보조금 변화' 놓고 갑론을박정부 ""배터리 재활용 고려해 보조금 지급""업계 ""LFP 배터리 전기차 삭감된다"" 우려



.2000만원 초반에 구매할 수 있는 레이 EV.세컨드카로 레이EV 구매를 고려하던 이모 씨(33)는 리튬인산철(LFP) 배터리를 단 전기차에 보조금이 삭감될 수도 있다는 소식을 듣고 고민에 빠졌다. 이 씨는 ""현행 보조금 지급 수준으로 봤을 때 가성비(가격 대비 성능)가 만족스러워 올해 구매를 고려했었는데, 보조금 정책이 바뀐다면 다시 따져봐야 될 것 같다""고 말했다. 'LFP 배터리' 단 전기차 보조금 축소되나1일 업계에 따르면 환경부는 올해 배터리 '재활용 가치'와 '1회 충전 주행거리' 등 고성능차 중심으로 전기차 보조금을 확대할 전망이다. 고부가가치 재활용을 촉진하고 글로벌 자원 안보 위기에 대응하기 위해서다.이를 두고 완성차 업계는 LFP 배터리에 지급되는 보조금을 축소하는 방향이 될 것으로 보고 있다.LFP 배터리는 니켈·코발트·망간(NCM) 등을 사용하는 삼원계 배터리보다 가격이 저렴해 중·소형 전기차 위주로 탑재되고 있다. 하지만 삼원계 배터리보다 재활용 가치는 떨어진다. LPF 배터리 재활용시 확보할 수 있는 유가 금속 가치가 삼원계 배터리의 약 30% 수준으로 알려졌다. 삼원계 배터리 대비 중량당 에너지 밀도가 낮아 1회 충전 주행거리가 짧다는 단점도 있다.



테슬라 모델Y RWD/사진=신용현 한경닷컴 기자 가성비 전기차로 인기였는데...'업계 비상'완성차 업계는 발등에 불이 떨어졌다. 삼원계 배터리 대비 가격이 저렴해 전기차 가격을 낮출 수 있는 LFP 배터리 탑재 비중을 늘리는 추세였기 때문. 기아 레이EV, KG모빌리티 토레스 EVX 등이 대표적인 LFP 배터리 전기차다. 특히 올해 현대차에서 출시 예정인 캐스퍼 일렉트릭, 기아의 보급형 소형 전기 스포츠유틸리티차량(SUV) EV3도 LFP 배터리를 탑재할 계획이다.최근 국내에서 인기를 끈 '중국산' 테슬라 모델Y 후륜구동은 중국 CATL의 LFP 배터리를 장착했는데, 미국에서 생산된 기존 모델Y보다 가격이 2000만원가량 저렴했다. 기아 레이도 지난해 레이EV의 인기에 힘입어 전체 판매량이 전년 대비 7000대 가까이 늘어났다.정부가 LFP 배터리를 단 전기차에 보조금을 줄일 경우 전기차 실구매 가격이 오를 가능성이 제기된다. 일례로 레이 EV는 지난해 정부와 지방자치단체에서 주는 보조금은 총 647만원으로 4인승 승용 라이트 트림은 2000만원대 초반에 구매할 수 있었지만, 올해 보조금 정책이 바뀌면 가격이 비싸질 수 있다. ""저렴한 전기차 살 기회였는데...아쉽다""소비자들 사이에서는 LFP 배터리 탑재 전기차 보조금 삭감 문제에 대해 갑론을박이 뜨겁다. 전기차 관련 온라인 커뮤니티에서 한 누리꾼은 ""작년에 레이EV를 산 사람이 승자""라고 했고, 또 다른 누리꾼은 ""LFP 배터리를 단 전기차는 대부분 시내 주행 정도 목적으로 가성비가 중요한데 보조금을 줄이면 이점이 사라질 것 같다""며 ""토레스EVX나 레이EV가 나오면서 전기차는 무조건 비싸다는 인식이 사라지나 싶었는데 아쉽다""고 덧붙였다.LFP 배터리를 탑재해 비교적 저렴한 소형이나 초소형 전기차를 판매했던 중소업체들이 직격탄을 맞을 것이란 지적도 나온다. 국내 전기차를 제작·수입·판매하는 업체 10여곳은 '대한민국 중소기업 전기차 발전 협의회'를 만들고 지난달 23일 긴급회의를 개최하기도 했다.이들은 ""국고 보조금 축소는 전기차 시장 활성화에 찬물을 끼얹는 것이다. 친환경차 확대와 탄소중립 정책에 역행하는 정책""이라면서 ""특히 중소업체들이 존폐를 위협받는 상황이 될 것""이라고 주장했다. 일부 초소형 전기차 업체들은 최근 환경부에 전기차 보조금 체계를 현행대로 유지해달라는 의견서를 제출한 것으로 알려졌다.업계 관계자는 ""중국산 전기차 견제 측면도 있지만, 지금으로서는 국내 전기차도 LFP 배터리를 많이 다는 추세""라며 ""정확한 정부 지침이 나올 때까지 지켜봐야 할 것""이라고 전했다.
]"
2024-02-06 11:11:01,'최대 680만원→650만원'…전기차 보조금 30만원 깎인다,https://n.news.naver.com/mnews/article/015/0004945692?sid=102,"[
환경부, 전기차 보조금 전면 개편전기승용차 성능보조금 100만원 감액배터리 성능 따라 차등…고효율 배터리 추가 지원보조금 전액 지원 차량가 5500만원 미만으로 강화



사진=연합뉴스전기차를 살 때 받을 수 있는 국가 보조금 최대 금액이 지난해보다 30만원 줄어든 650만원으로 책정됐다. 보조금을 최대로 받을 수 있는 전기차 가격은 5500만원으로 낮아졌다. 1회 충전 주행거리에 따른 보조금 차등도 강화되며 충전속도나 배터리 효율에 따라 차등 지원하기 위한 배터리효율계수 등이 신규 도입된다. 친환경적인 전기차 보급을 지원하고 배터리 기술혁신을 유도하는 차원이다. 환경부는 6일 이 같은 내용의 ‘2024년 전기차 구매보조금 개편방안(이하 보조금 개편안)’을 공개했다. 성능보조금은 줄이되 1회 충전 시 주행거리가 길고 배터리 성능이 높은 차량에 대한 보조금을 더 주는 내용이 골자다.  ○전기 승용차 성능보조금 100만원 감액...배터리 성능 따라 보조금 차등전기승용차의 성능보조금 단가를 100만 원 감액한다. 중대형 승용차의 경우 기존 최대 500만원에서 400만원으로, 경소형 승용차는 기존 400만원에서 300만원으로 지원금이 줄어든다.1회 충전 주행거리에 따른 보조금 차등도 강화한다. 중·대형 차량은 1회 충전 주행거리에 따른 차등 구간을 기존 450km에서 500km까지 확대하고, 주행거리 400km 미만 차량 지원은 대폭 축소한다.보조금이 전액 지원되는 차량가격 기준도 당초 5700만 원 미만에서 올해 5500만 원 미만으로 강화한다. 국산 전기차는 대체로 5500만원 이하 가격대지만 지난해 출시된 테슬라 모델 Y의 가격은 5699만원으로 올해 보조금 지원 범위를 벗어난다. 5500만원에서 8500만원 미만의 경우 50%의 보조금이 지급되며 8500만원 이상인 경우 보조금이 지급되지 않는다. 2025년부터는 전액 지급 기준을 최대 5300만원 미만으로 강화한다는 방침이다. 또 자동차 제작사의 차량 할인금액에 비례한 인센티브도 최대 100만 원까지 지급할 수 있다.충전속도가 빠른 차량을 구매할 경우 최대 30만원의 인센티브를 제공하며 차량정보수집장치(OBDⅡ) 탑재차량 구매 시 배터리안전보조금 20만원을 지급한다. 전기승용차에도 '배터리효율계수'를 도입해 배터리 에너지밀도에 따라 차등 지원하고, 배터리 재활용 가치에 따른 '배터리 환경성계수'를 새로 도입한다.전기 승용차 제작사의 사후관리 및 충전 기반 인프라에 따라 사후 관리계 수도 차등화한다. 전기차 사후관리·충전여건 개선을 위한 제작사 책임을 강화하는 차원이다. 당초 직영 정비센터를 1개 이상 운영하는 제작사 차량에 대해 사후관리계수 1.0을 적용했으나, 올해는 서울, 경기 등 8개 전 권역에 직영 정비센터를 운영하는 제작사 차량에 대해서만 사후관리계수 1.0을 적용한다.제작사 충전 기반 확충 시 지급되는 인센티브 규모는 최대 40만 원으로 확대한다. 당초 최근 3년 내 100기 이상 설치 시 20만원을 지원했지만, 앞으론 최근 3년내 100기 이상 설치 시 20만원, 200기 이상 설치 시 40만원을 지원한다.배터리 성능에 따른 보조금 차등을 강화한 이유는 배터리 성능이 상대적으로 떨어지는 중국산 전기 자동차를 견제하는 차원이다. 중국산 전기차는 대체로 리튬인산철(LFP) 배터리를 쓰는데 국산 전기차들이 주로 사용하는 NCM(니켈·코발트·망간) 배터리보다 효율이 떨어진다는 평가를 받는다. 성능보조금은 감액했지만 충전인프라보조금, 배터리안전보조금, 혁신기술 보조금 등이 조금씩 오르면서 대형 승용차 기준으로 최대 지원금은 최대 650만원이 된다. 지난해 최대 680만원보다 30만원 줄어드는 셈이다.차상위 이하 계층 구매 시 추가지원금을 당초 국비 보조금의 10%에서 20%로 상향하고 이 중 청년 생애 최초 구매자에 대해서는 30%를 추가지원한다.영업용 전기 승용차 구매 지원은 강화한다. 택시용 구매 시 추가 지원금을 당초 200만 원에서 250만 원으로 확대한다. 주행거리가 긴 영업용 차량도 충분한 사후관리 혜택을 누릴 수 있도록 10년/50만km 이상 사후관리를 보증하는 제작사 차량에 30만 원을 추가 지원한다. ○전기버스 배터리안전 보조금은 700만원 늘려전기버스는 1회 충전 주행거리 500km 이상의 성능을 보유한 차량에 대해 500만 원을 추가 지원한다.배터리안전보조금 지급규모도 당초 300만 원에서 1000만 원으로 확대한다. 다만 지급요건은 기존 ‘구동축전지 안전성 시험’ 통과에서 OBDⅡ 탑재, 충전 중 무선통신 또는 충전커넥터를 통해 배터리 정보 제공 등을 추가로 요구한다.배터리환경성계수(1.0~0.6)를 새로이 도입하며, 전기승합차 제작사가 최소 9년/90만km(대형버스 기준) 보증을 위한 이행보증보험 미가입 시 보조금을 80% 삭감한다.어린이 통학용으로 전기승합차 구매 시 추가 지원 수준은 기존 500만원에서 국비보조금의 20% 수준으로 높인다.전기화물차는 성능보조금 단가를 1200만원에서 1100만 원으로 감액하고 성능에 따른 차등폭은 확대한다. 충전속도가 90kW 미만인 소형 전기화물차에 대해서는 보조금 50만원을 삭감하는 '충전 차등 기준'을 도입하며, 전기화물차에도 전기승용차와 동일한 배터리효율계수와 배터리 환경성 계수 기준을 적용한다.경유화물차 보유자가 전기화물차를 구매하는 경우 기존 경유화물차 폐차 미이행 시 성능보조금 50만원을 차감한다. 폐차 이행 시에는 50만 원을 추가 지원하되, 노후경유차 폐차로 조기폐차 지원금을 이미 수령한 자에 대해서는 20만 원만 추가 지원한다.환경부는 이번 보조금 개편안 내용을 담은 ‘2024년 전기자동차 보급사업 보조금 업무처리지침’을 6일부터 행정예고하고 15일까지 의견 수렴을 실시할 예정이다.정선화 환경부 대기환경정책관은 “이번 보조금 개편안에는 변동하는 시장여건에 대응한 전기차 보급 촉진뿐만 아니라 고성능 전기차 위주 보급과 기술혁신을 유도하기 위한 조치들을 담았다”라며 “환경적으로도 우수한 전기차를 보급하여 전기차 대중화를 통한 대기질 개선과 온실가스 감축에 기여하겠다”라고 밝혔다.곽용희 기자 kyh@hankyung.co
		]"
2024-02-06 11:42:01,테슬라 사면 300만원 덜 받는다.... 현대차가 전기차 보조금 유리한 이유,https://n.news.naver.com/mnews/article/023/0003815287?sid=101,"[
환경부, 전기차 보조금 개편안 발표 배터리 성능 따져 보조금 차등 “소비자 싼 차를 비싸게 사야 하는 역설적 상황도”



서울 시내 전기차 충전소 모습. /뉴스1										올해 국산 전기차와 수입 전기차를 살 때 정부에서 받을 수 있는 보조금 차이가 커진다. 전기차 배터리의 에너지밀도, 폐기된 이후 배터리의 재활용 가치, 배터리 충전 속도 등을 종합적으로 따져 전기차 보조금을 다르게 지급하기로 했기 때문이다. 가볍고 성능이 좋고, 재활용이 쉬운 배터리에 더 많은 보조금을 주겠다는 취지다. 결국 에너지밀도가 높고 재활용 가치가 큰 금속을 쓰는 NCM(니켈·코발트·망간) 배터리를 탑재한 국산차에 대한 보조금이 늘게 된다. 반면 상대적으로 성능이 떨어지는 LFP(리튬인산철) 배터리를 단 수입차, 특히 중국 전기차엔 불리해진다.환경부, 산업통상자원부, 기획재정부는 이 같은 내용을 골자로 한 ‘2024 전기차 보조금 개편안’을 6일 발표했다. 개편안에 따르면 전기 승용차에 지급되는 국고 보조금 최대치는 지난해보다 30만원 줄어든 650만원으로 정해졌다. 보조금 전액을 받을 수 있는 차량 가격 기준도 지난해 5700만원 미만에서 5500만원 미만으로 변경된다.



그래픽=김하경 배터리 밀도, 재활용 가치 따진다							정부는 전기차 업체의 성능·안전, 충전기 설치 여부, 배터리 고속 충전 가능 여부 등에 따라 보조금 액수를 달리했다. 올해 가장 큰 변화는 중형 이상 전기차 보조금을 지급할 때 탑재한 배터리의 에너지밀도, 재활용 가치를 기준으로 삼은 점이다. 배터리 에너지밀도 기준치를 채우지 못하면 보조금을 깎는 구조이다. 에너지밀도가 높은 NCM 배터리를 단 아이오닉5와 LFP 배터리를 단 수입차의 보조금이 최대 170만원 차이가 날 수 있다.또 배터리 재활용 가치에 따라서도 보조금이 다르다. 이는 폐배터리에서 추출되는 금속 가치로 매겨진다. 폐배터리에서 나오는 1㎏당 유가금속의 가격을 합쳐 값이 낮을수록 보조금을 줄이는 방식이다. 이 역시 상대적으로 비싼 니켈, 코발트 등을 쓰는 NCM 배터리를 탑재한 국산차가 상대적으로 보조금을 더 받게 된다.이 밖에도 전기차의 고질적인 약점으로 꼽히는 충전 시간을 고려해 고속 충전 기능이 있는 차량에 30만원을 추가로 준다. 운행 이력과 배터리 상태 등 차량 상태를 확인할 수 있는 ‘운행 기록 진단 장치(OBD)’ 유무에 따라서도 20만원의 차이를 둔다.자동차 AS 센터 관련 규정도 까다로워졌다. 지난해엔 직영 AS 센터가 1곳이라도 있으면 보조금이 깎이지 않았지만 올해는 전국 8개 권역에 각각 1곳 이상 있어야 감액을 피할 수 있다. 충전기 설치 관련 보조금도 차이가 커졌다. 최근 3년 내 급속 충전기를 100기 이상 설치한 자동차 회사가 만든 전기차에는 20만원, 200기 이상 설치한 제조사 전기차에는 40만원이 주어진다.소비자 입장에선 싼 차를 비싸게 사는 꼴							이번 전기차 보조금 개편으로 가장 불리한 위치에 놓인 건 테슬라다. 테슬라는 LFP 배터리를 탑재한 전기 승용차를 들여오는 유일한 업체다. 현대차와 테슬라 차량의 보조금 차이는 300만원가량으로 벌어질 것으로 보인다.다만, 이번 전기차 보조금 정책에 대해 국내 업계에서도 우려하는 목소리가 나온다. 최근 전기차 수요 둔화 등이 이어지자 국내 업체들도 성능은 다소 떨어지지만 값이 싼 LFP 배터리 탑재를 늘리고 있기 때문이다. 특히 LFP 배터리를 탑재한 KG모빌리티 토레스EV의 타격이 예상된다. 현대차 역시 자체적으로 LFP 배터리를 개발하겠다는 계획을 밝혔는데, 국내에선 소형차 위주로만 탑재해야 할 것으로 전망된다. 이미 LFP 배터리 상용화 계획을 밝힌 국내 배터리 3사 역시 고심이 커질 수밖에 없다. 박철완 대통령직속 탄소중립녹색성장위 민간위원은 “이미 LFP 사용이 세계적 추세가 된 시점과는 맞지 않는 (보조금) 정책을 들고나온 것”이라고 했다.소비자 입장에선 싼 차를 비싸게 사야 하는 역설적 상황을 마주해야 한다. 업체들이 값싼 LFP 배터리를 탑재해 차량 가격을 낮추는데, 이런 차량에 대한 정부 보조금은 깎이면서 가격 인하 효과가 줄기 때문이다.
]"
2024-02-06 14:36:01,"코스모화학, LFP 배터리 원료 인산철 제조법 특허 출원",https://n.news.naver.com/mnews/article/009/0005255374?sid=101,"[




 코스모화학 황산철 및 인산철 모습. &lt;사진 제공=코스모화학&gt;이차전지 소재 전문기업 코스모화학이 자사 연구소에서 이산화티타늄 생산 부산물로 발생하는 황산철을 사용해 리튬철인산염(LFP) 배터리 원료로 사용되는 인산철 제조방법을 특허 출원했다고 6일 밝혔다.코스모화학은 광석 제련을 통해 대표적인 백색안료인 이산화티타늄과 이처전지 양극재 주요 원료인 황산코발트를 국내에서 유일하게 생산하고 있다. 최근 폐배터리 리사이클을 통해 삼원계 배터리의 주요 원료인 니켈, 코발트, 리튬, 망간 등을 회수하는 사업에 뛰어들었다.코스모화학이 이번에 출원한 특허 기술은 이산화티타늄을 생산하는 과정에서 발생하는 황산철을 사용해 LFP의 주요 원료 중 하나인 인산철을 제조하는 것과 관련이 있다.이산화티타늄 원광석에는 다량의 철(Fe) 성분이 함유돼 있어 황산철 형태로 약 10만~15만t이 부산물로 발생된다. 이러한 황산철은 현재는 폐수처리장에서 무기물을 응집하는 용도로 판매되고 있지만 인산철로 제조해 사업화하게 되면 부산물을 활용해 고부가가치 사업으로 전환할 수 있다.코스모화학은 LFP 배터리 제조에 사용되는 탄산리튬을 폐배터리 리사이클 공장에서 생산하고 있다. 향후 황산철로 만든 인산철과 탄산리튬을 결합해 LFP 전구체 및 양극재 생산에서 상당한 원가 경쟁력을 확보할 것으로 기대된다.회사 관계자는 “최근 배터리 3사 및 국내 주요 양극재 기업들도 LFP 배터리 사업화에 열을 올리는 시장 상황을 감안하면 향후 국내 LFP 양극재 시장도 급격히 성장할 것”이라며 “이번 특허 출원을 통해 LFP 시장 진출을 위한 첫 삽을 뜬 셈”이라고 설명했다.앞으로 인산철 제조를 위해서는 황산철 순도를 배터리 사용급으로 높이는 공정 개발과 인산철의 또 다른 주요 원료인 인광석 조달 문제 등이 해결 과제로 남아있다. 코스모화학은 향후 2~3년 내에 개발을 완료해 사업화할 수 있도록 개발에 속도를 내고 있다.코스모화학 관계자는 “최근 전기차 수요가 급증하면서 배터리에 대한 니즈도 다양해질 것”이라며 “코스모화학이 가진 제련기술을 활용해 모든 이차전지 배터리를 재활용할 수 있는 소재 전문회사가 되기 위해 연구개발에 집중하고 있다”고 밝혔다.
]"
